{
  "schema_version": "1.0",
  "handoff_id": "11111111-1111-1111-1111-111111111111",
  "custody_id": "CUST-2026-0001",
  "submitted_at": "2026-06-14T12:00:00Z",
  "submitted_by": "WitnessVault",
  "source_file": {
    "path": "/vault/raw/CUST-2026-0001.m4a",
    "filename": "CUST-2026-0001.m4a",
    "sha256": "aaaaaaaaaaaaaaaaaaaaaaaaaaaaaaaaaaaaaaaaaaaaaaaaaaaaaaaaaaaaaaaa",
    "size_bytes": 1048576,
    "media_type": "audio",
    "format": "m4a"
  },
  "context": {
    "case_id": "CASE-2026-001",
    "event_date": "2026-06-10",
    "sensitivity": "standard"
  },
  "processing_instructions": {
    "transcribe": true,
    "diarize": true,
    "language": "en"
  }
}
